コード,名称,業種,市場
PLAB,フォトロニクス (Photronics Inc),情報技術,Nasdaq
PLAN,アナプラン (Anaplan Inc),情報技術,NYSE
PLAY,デイブ＆バスターズ・エンターテインメント (Dave & Busters Entertainment Inc),一般消費財,Nasdaq
PLCE,チルドレンズ・プレイス (The Childrens Place Inc),一般消費財,Nasdaq
PLIN,"ChinaXiangtaiFoodCoLtd (China Xiangtai Food Co., Ltd)",生活必需品,Nasdaq
PLM,ポリメット・マイニング (PolyMet Mining Corp),素材,
PLMR,"PalomarHoldingsInc (Palomar Holdings, Inc)",金融,Nasdaq
PLNT,プラネット・フィットネス　クラスA (Planet Fitness Inc),一般消費財,NYSE
PLOW,ダグラス・ダイナミクス (Douglas Dynamics Inc),一般消費財,NYSE
PLPC,プリフォームド・ライン・プロダクツ (Preformed Line Products Company),情報技術,Nasdaq
PLSE,パルス・バイオサイエンシズ (Pulse Biosciences Inc),ヘルスケア,Nasdaq
PLT,プラントニクス (Plantronics Inc),情報技術,NYSE
PLUG,プラグ・パワー (Plug Power Inc),情報技術,Nasdaq
PLUS,イー・プラス (ePlus inc),情報技術,Nasdaq
PLXP,PLxファーマ (PLx Pharma Inc),ヘルスケア,Nasdaq
PLXS,プレクサス (Plexus Corp),情報技術,Nasdaq
PLYA,プラヤ・ホテル&リゾーツ (Playa Hotels & Resorts N.V),一般消費財,Nasdaq
PM,フィリップ・モリス・インターナショナル (Philip Morris International),生活必需品,S&P500
PMD,サイケメディクス (Psychemedics Corporation),ヘルスケア,Nasdaq
PME,ピンタン・マリン・エンタープライズ (Pingtan Marine Enterprise Ltd),生活必需品,Nasdaq
PNC,PNCファイナンシャル・サービシズ・グループ (PNC Financial Services),金融,S&P500
PNFP,ピナクル・フィナンシャル・パートナーズ (Pinnacle Financial Partners Inc),金融,Nasdaq
PNM,ピーエヌエム・リソーシズ (PNM Resources Inc),公益事業,NYSE
PNR,ペンテア (Pentair plc),資本財,S&P500
PNTG,"PennantGroupInc/The (The Pennant Group, Inc)",ヘルスケア,Nasdaq
PNW,ピナクル・ウエスト・キャピタル (Pinnacle West Capital),公益事業,S&P500
PODD,インシュレット (Insulet Corporation),ヘルスケア,Nasdaq
POL,ポリワン・コーポレーション (PolyOne Corporation),素材,NYSE
POOL,プール (Pool Corporation),一般消費財,Nasdaq
POR,ポートランド・ジェネラル・エレクトリック (Portland General Electric Company),公益事業,NYSE
POST,ポスト・ホールディングス (Post Holdings Inc),生活必需品,NYSE
POWI,パワー・インテグレーションズ (Power Integrations Inc),情報技術,Nasdaq
POWL,パウエル・インダストリーズ (Powell Industries Inc),資本財,Nasdaq
PPBI,パシフィック・プレミア・バンコープ (Pacific Premier Bancorp Inc),金融,Nasdaq
PPC,ピルグリムズ･プライド (Pilgrims Pride Corporation),生活必需品,Nasdaq
PPD,"PPDInc (PPD, Inc)",ヘルスケア,Nasdaq
PPG,PPGインダストリーズ (PPG Industries),素材,S&P500
PPH,VanEck Vectors Pharmaceutical ETF (VanEck Vectors Pharmaceutical ETF),,
PPIH,パーマパイプ・インターナショナル・ホールディングス (Perma-Pipe International Holdings Inc),資本財,Nasdaq
PPL,PPL (PPL Corp.),公益事業,S&P500
PPSI,パイオニア・パワー・ソリューションズ (Pioneer Power Solutions Inc),情報技術,Nasdaq
PQG,PQグループ・ホールディングス (PQ Group Holdings Inc),素材,NYSE
PRA,プロアシュアランス (ProAssurance Corporation),金融,NYSE
PRAA,PRAグループ (PRA Group Inc),金融,Nasdaq
PRAH,PRAヘルス・サイエンシズ (PRA Health Sciences Inc),ヘルスケア,Nasdaq
PRCP,パーセプトロン (Perceptron Inc),情報技術,Nasdaq
PRDO,ペルドチェオ・エデュケーション (Perdoceo Education Corporation),一般消費財,Nasdaq
PRFT,パーフィシェント (Perficient Inc),情報技術,Nasdaq
PRGO,ペリゴ (Perrigo),ヘルスケア,S&P500
PRGS,プログレス・ソフトウェア (Progress Software Corporation),情報技術,Nasdaq
PRI,プライメリカ (Primerica Inc),金融,NYSE
PRK,パーク・ナショナル (Park National Corporation),金融,NYSE
PRLB,プロト・ラブズ (Proto Labs Inc),資本財,NYSE
PRMW,プリモ・ウォーター (Primo Water Corporation),生活必需品,NYSE
PRNB,PrincipiaBiopharmaInc (Principia Biopharma Inc),ヘルスケア,Nasdaq
PRO,プロス・ホールディングス (PROS Holdings Inc),情報技術,NYSE
PROS,"ProSightGlobalInc (ProSight Global, Inc)",金融,NYSE
PROV,プロビデント・フィナンシャル・ホールディングス (Provident Financial Holdings Inc),金融,Nasdaq
PRPL,"パープル・イノベーション (Purple Innovation, Inc)",一般消費財,Nasdaq
PRSC,プロビデンス・サービス (The Providence Service Corporation),ヘルスケア,Nasdaq
PRSP,パースペクタ (Perspecta Inc),情報技術,NYSE
PRTA,プロセナ (Prothena Corporation plc),ヘルスケア,Nasdaq
PRTK,パラテック・ファーマシューティカルズ (Paratek Pharmaceuticals Inc),ヘルスケア,Nasdaq
PRTS,ユーエス・オート・パーツ・ネットワーク (U.S. Auto Parts Network Inc),一般消費財,Nasdaq
PRTY,パーティ・シティ・ホールドコ (Party City Holdco Inc),一般消費財,NYSE
PRU,プルデンシャル・ファイナンシャル (Prudential Financial),金融,S&P500
PRVB,"ProventionBioInc (Provention Bio, Inc)",ヘルスケア,Nasdaq
PRVL,PrevailTherapeuticsInc (Prevail Therapeutics Inc),ヘルスケア,Nasdaq
PS,プルラルサイト (Pluralsight Inc),情報技術,Nasdaq
PSEC,プロスペクト・キャピタル (Prospect Capital Corporation),金融,Nasdaq
PSMT,プライススマート (PriceSmart Inc),一般消費財,Nasdaq
PSN,ParsonsCorp (Parsons Corporation),資本財,NYSE
PSNL,"PersonalisInc (Personalis, Inc)",ヘルスケア,Nasdaq
PSO,ピアソン (Pearson plc),電気通信,NYSE
PSTG,ピュア・ストレージ　クラスA (Pure Storage Inc),情報技術,NYSE
PSTI,プルリステム・セラピューティクス (Pluristem Therapeutics Inc),ヘルスケア,Nasdaq
PSTV,"サイトリ・セラピューティクス (Plus Therapeutics, Inc)",ヘルスケア,Nasdaq
PSX,フィリップス66 (Phillips 66),エネルギー,S&P500
PTC,ピー・ティー・シー (PTC Inc),情報技術,Nasdaq
PTCT,PTCセラピューティクス (PTC Therapeutics Inc),ヘルスケア,Nasdaq
PTEN,パターソン・ユーティーアイ・エナジー (Patterson-UTI Energy Inc),エネルギー,Nasdaq
PTGX,プロタゴニスト・セラピューティクス (Protagonist Therapeutics Inc),ヘルスケア,Nasdaq
PTI,プロテオスタシス・セラピューティクス (Proteostasis Therapeutics Inc),ヘルスケア,Nasdaq
PTN,パラティン・テクノロジーズ (Palatin Technologies Inc),ヘルスケア,NYSE
PTON,"PelotonInteractiveInc (Peloton Interactive, Inc)",一般消費財,Nasdaq
PTR,ペトロチャイナ (PetroChina Company Limited),エネルギー,NYSE
PTSI,ＰＡＭトランスポーテーション・サービシズ (P.A.M. Transportation Services Inc),資本財,Nasdaq
PTVCB,プロテクティブ・インスランス・コーポレーション クラスB (Protective Insurance Corporation),金融,Nasdaq
PUK,プルーデンシャル (Prudential plc),金融,NYSE
PULM,プルマトリックス (Pulmatrix Inc),ヘルスケア,Nasdaq
PUMP,プロペトロ・ホールディング (ProPetro Holding Corp),エネルギー,NYSE
PVAC,ペン・バージニア (Penn Virginia Corporation),エネルギー,Nasdaq
PVBC,"ProvidentBancorpInc (Provident Bancorp, Inc)",金融,Nasdaq
PVG,プレチウム・リソーシズ (Pretium Resources Inc),素材,NYSE
PVH,PVH (PVH Corp.),一般消費財,S&P500
PWOD,ペン･ウッズ・バンコープ (Penns Woods Bancorp Inc),金融,Nasdaq
PWR,クアンタ・サービシーズ (Quanta Services Inc.),資本財,S&P500
PXD,パイオニア・ナチュラル・リソーシズ (Pioneer Natural Resources),エネルギー,S&P500
PXF,Invesco FTSE RAFI Developed Markets ex-U.S. ETF (Invesco FTSE RAFI Developed Markets ex-U.S. ETF),,
PXLW,ピクセルワークス (Pixelworks Inc),情報技術,Nasdaq
PYPL,ペイパル・ホールディングス (PayPal),情報技術,Nasdaq S&P500
PZG,パラマウント・ゴールド・ネバダ (Paramount Gold Nevada Corp),素材,NYSE
PZN,ツェナ・インベストメント・マネジメント クラスA (Pzena Investment Management Inc),金融,NYSE
PZZA,パパ・ジョンズ・インターナショナル (Papa Johns International Inc),一般消費財,Nasdaq
QADA,キューエーディー クラスA (QAD Inc),情報技術,Nasdaq
QCOM,クアルコム (QUALCOMM Inc.),情報技術,Nasdaq S&P500
QCRH,"QCRホールディングス (QCR Holdings, Inc)",金融,Nasdaq
QD,クディアン (Qudian Inc),金融,NYSE
QDEL,キデル (Quidel Corporation),ヘルスケア,Nasdaq
QDIV,Global X S&P 500 Quality Dividend ETF (Global X S&P 500 Quality Dividend ETF),,
QEP,キューイーピー・リソーシズ (QEP Resources Inc),エネルギー,NYSE
QGEN,キアゲン (QIAGEN N.V),ヘルスケア,NYSE
QLYS,クォリーズ (Qualys Inc),情報技術,Nasdaq
QMCO,クアンタム (Quantum Corporation),情報技術,NYSE
QNST,クインストリート (QuinStreet Inc),情報技術,Nasdaq
QQQ,Invesco QQQ Trust (Invesco QQQ Trust),,
QRTEA,キュレート・リテール・グループ クラスA (Qurate Retail Inc),一般消費財,Nasdaq
QRVO,コルボ (Qorvo),情報技術,Nasdaq S&P500
QSR,レストラン・ブランズ・インターナショナル (Restaurant Brands International Inc),一般消費財,NYSE
QTNT,クオティエント (Quotient Limited),ヘルスケア,Nasdaq
QTRX,クアンテリックス (Quanterix Corporation),ヘルスケア,Nasdaq
QTT,趣頭条 (Qutoutiao Inc),情報技術,Nasdaq
QTWO,Q2ホールディングス (Q2 Holdings Inc),情報技術,NYSE
QUAD,クアド・グラフィックス (Quad/Graphics Inc),資本財,NYSE
QUIK,クイックロジック (QuickLogic Corporation),情報技術,Nasdaq
QUMU,ケームー (Qumu Corporation),情報技術,Nasdaq
QUOT,クオシェント・テクノロジー (Quotient Technology Inc),一般消費財,NYSE
QURE,ユニキュア (uniQure N.V),ヘルスケア,Nasdaq
QYLD,Global X NASDAQ 100 Covered Call ETF (Global X NASDAQ 100 Covered Call ETF),,
R,ライダー・システム (Ryder System Inc),資本財,NYSE
RACE,フェラーリ (Ferrari N.V),一般消費財,NYSE
RADA,ラダ・エレクトロニック・インダストリーズ (RADA Electronic Industries Ltd),資本財,Nasdaq
RAIL,フレイトカー･アメリカ (FreightCar America Inc),資本財,Nasdaq
RAMP,ライブランプ・ホールディングス (LiveRamp Holdings Inc),情報技術,Nasdaq
RAPT,"RAPTTherapeuticsInc (RAPT Therapeutics, Inc)",ヘルスケア,Nasdaq
RARE,ウルトラジェニクス・ファーマシューティカルズ (Ultragenyx Pharmaceutical Inc),ヘルスケア,Nasdaq
RAVE,"レイブ・レストラン・グループ (RAVE Restaurant Group, Inc)",一般消費財,Nasdaq
RAVN,レーベン・インダストリーズ (Raven Industries Inc),資本財,Nasdaq
RBB,RBBバンコープ (RBB Bancorp),金融,Nasdaq
RBBN,リボン・コミュニケーションズ (Ribbon Communications Inc),電気通信,Nasdaq
RBC,リーガル・ベロイト (Regal Beloit Corporation),資本財,NYSE
RBCAA,リパブリック・バンコープ クラスA (Republic Bancorp Inc),金融,Nasdaq
RBCN,ルビコン・テクノロジー (Rubicon Technology Inc),情報技術,Nasdaq
RBNC,"ReliantBancorpInc (Reliant Bancorp, Inc)",金融,Nasdaq
RBS,ロイヤルバンクスコットランドグループ (The Royal Bank of Scotland Group plc),金融,NYSE
RCI,ロジャース・コミュニケーションズ クラスB (Rogers Communications Inc),電気通信,NYSE
RCII,レントＡセンター (Rent-A-Center Inc),資本財,Nasdaq
RCKT,ロケット・ファーマシューティカルズ (Rocket Pharmaceuticals Inc),ヘルスケア,Nasdaq
RCKY,ロッキー・ブランズ (Rocky Brands Inc),一般消費財,Nasdaq
RCL,ロイヤル・カリビアン・クルーズ (Royal Caribbean Group),一般消費財,S&P500
RCM,R1RCM (R1 RCM Inc),情報技術,Nasdaq
RCUS,アーカス・バイオサイエンシズ (Arcus Biosciences Inc),ヘルスケア,NYSE
RDFN,レッドフィン (Redfin Corporation),不動産,Nasdaq
RDI,リーディング・インターナショナル クラスA (Reading International Inc),一般消費財,Nasdaq
RDN,ラディアン･グループ (Radian Group Inc),金融,NYSE
RDNT,"ラドネット (RadNet, Inc)",ヘルスケア,Nasdaq
RDUS,ラディウス・ヘルス (Radius Health Inc),ヘルスケア,Nasdaq
RDVT,"RedVioletInc (Red Violet, Inc)",資本財,Nasdaq
RDWR,ラドウェア (Radware Ltd),情報技術,Nasdaq
RDY,ドクタ・レディーズ・ラボラトリーズ (Dr. Reddys Laboratories Limited),ヘルスケア,NYSE
RE,エベレスト・リ・グループ (Everest Re Group Ltd.),金融,S&P500
REAL,"RealRealInc/The (The RealReal, Inc)",一般消費財,Nasdaq
REGI,リニューアブル・エナジー・グループ (Renewable Energy Group Inc),エネルギー,Nasdaq
REGN,リジェネロン・ファーマシューティカルズ (Regeneron Pharmaceuticals),ヘルスケア,Nasdaq S&P500
RELL,リチャードソン・エレクトロニクス (Richardson Electronics Ltd),情報技術,Nasdaq
RELX,レレックス (RELX PLC),資本財,NYSE
REMX,VanEck Vectors Rare Earth/Strategic Metals ETF (VanEck Vectors Rare Earth/Strategic Metals ETF),,
REPH,レクロ・ファーマ (Recro Pharma Inc),ヘルスケア,Nasdaq
REPL,"ReplimuneGroupInc (Replimune Group, Inc)",ヘルスケア,Nasdaq
RES,アールピーシー (RPC Inc),エネルギー,NYSE
RESN,レゾナント (Resonant Inc),情報技術,Nasdaq
RETA,レアタ・ファーマシューティカルズ　クラスA (Reata Pharmaceuticals Inc),ヘルスケア,Nasdaq
RETO,レト・エコソリューションズ (ReTo Eco-Solutions Inc),素材,Nasdaq
REV,レブロン クラスA (Revlon Inc),生活必需品,NYSE
REVG,REVグループ (REV Group Inc),一般消費財,NYSE
REX,レックス・アメリカン・リソーシズ (REX American Resources Corporation),素材,NYSE
REXN,"レクサン・ファーマシューティカルズ (Rexahn Pharmaceuticals, Inc)",ヘルスケア,Nasdaq
REYN,ReynoldsConsumerProductsI (REYNOLDS CONSUMER PRODUCTS INC.),,Nasdaq
REZI,レジデオ・テクノロジーズ (Resideo Technologies Inc),資本財,NYSE
RF,リージョンズ・ファイナンシャル (Regions Financial Corp.),金融,S&P500
RFIL,RFインダストリーズ (RF Industries Ltd),情報技術,Nasdaq
RFL,ラファエル・ホールディングス クラスB (Rafael Holdings Inc),ヘルスケア,NYSE
RFP,リゾルト・フォレスト・プロダクツ (Resolute Forest Products Inc),素材,NYSE
RGA,リインシュアランス・グループ・オブ・アメリカ (Reinsurance Group of America Incorporated),金融,NYSE
RGCO,"RGCリソーシズ (RGC Resources, Inc)",公益事業,Nasdaq
RGEN,レプリジェン (Repligen Corporation),ヘルスケア,Nasdaq
RGLD,ロイヤル・ゴールド (Royal Gold Inc),素材,Nasdaq
RGLS,レグルスセラピューティクス (Regulus Therapeutics Inc),ヘルスケア,Nasdaq
RGNX,レジェンクスバイオ (REGENXBIO Inc),ヘルスケア,Nasdaq
RGP,リソーシズ・コネクション (Regency Energy Partners LP),エネルギー,NYSE
RGR,スターム・ルガー (Sturm Ruger & Company Inc),資本財,NYSE
RGS,リージス (Regis Corporation),生活必需品,NYSE
RH,RH (RH),一般消費財,NYSE
RHI,ロバート・ハーフ・インターナショナル (Robert Half International),資本財,S&P500
RICK,リックス・キャバレー・インターナショナル (RCI Hospitality Holdings Inc),一般消費財,Nasdaq
RIG,トランスオーシャン (Transocean Ltd),エネルギー,NYSE
RIGL,リジェル・ファーマシューティカルズ (Rigel Pharmaceuticals Inc),ヘルスケア,Nasdaq
RILY,"B.ライリー・ファイナンシャル (B. Riley Financial, Inc)",金融,Nasdaq
RIO,リオ・ティント (Rio Tinto plc),素材,NYSE
RIOT,リオット・ブロックチェーン (Riot Blockchain Inc),金融,Nasdaq
RJF,レイモンド・ジェームズ・ファイナンシャル (Raymond James Financial Inc.),金融,S&P500
RL,ラルフローレン (Ralph Lauren Corporation),一般消費財,S&P500
RLGT,"ラディアント・ロジスティクス (Radiant Logistics, Inc)",資本財,NYSE
RLGY,リアロジーホールディングス (Realogy Holdings Corp),不動産,NYSE
RLH,レッド・ライオン・ホテルズ (Red Lion Hotels Corporation),一般消費財,NYSE
RLI,アールエルアイ (RLI Corp),金融,NYSE
RLMD,"レルマダ・セラピューティクス (Relmada Therapeutics, Inc)",ヘルスケア,Nasdaq
RLY,SPDR SSgA Multi-Asset Real Return ETF (SPDR SSgA Multi-Asset Real Return ETF),,
RM,リージョナル・マネジメント (Regional Management Corp),金融,NYSE
RMAX,リ・マックス・ホールディングス クラスA (RE/MAX Holdings Inc),不動産,NYSE
RMBS,ラムバス (Rambus Inc),情報技術,Nasdaq
RMCF,ロッキー・マウンテン・チョコレート・ファクトリー (Rocky Mountain Chocolate Factory Inc),生活必需品,Nasdaq
RMD,レスメド (ResMed),ヘルスケア,S&P500
RMNI,"リミニ・ストリート (Rimini Street, Inc)",情報技術,Nasdaq
RMR,RMRグループ (The RMR Group Inc),不動産,Nasdaq
RMTI,ロックウェル・メディカル (Rockwell Medical Inc),ヘルスケア,Nasdaq
RNET,リグネット (RigNet Inc),情報技術,Nasdaq
RNG,リングセントラル クラスA (RingCentral Inc),情報技術,NYSE
RNR,ルネサンスリー・ホールディングス (RenaissanceRe Holdings Ltd),金融,NYSE
RNST,レナサント (Renasant Corporation),金融,Nasdaq
RNWK,リアルネットワークス (RealNetworks Inc),情報技術,Nasdaq
ROBO,Robo Global Robotics and Automation Index ETF (Robo Global Robotics and Automation Index ETF),,
ROCK,ジブラルタル・インダストリーズ (Gibraltar Industries Inc),素材,Nasdaq
ROG,ロジャーズ (Rogers Corporation),情報技術,NYSE
ROK,ロックウェル・オートメーション (Rockwell Automation Inc.),資本財,S&P500
ROKU,ロク (Roku Inc),電気通信,Nasdaq
ROL,ロリンズ (Rollins Inc.),資本財,S&P500
ROLL,アールビーシー・ベアリングス (RBC Bearings Incorporated),資本財,Nasdaq
ROP,ローパー・テクノロジーズ (Roper Technologies),資本財,S&P500
ROST,ロス・ストアーズ (Ross Stores),一般消費財,Nasdaq S&P500
RP,リアルページ (RealPage Inc),情報技術,Nasdaq
RPAY,RepayHoldingsCorp (Repay Holdings Corporation),情報技術,Nasdaq
RPD,ラピッド7 (Rapid7 Inc),情報技術,Nasdaq
RPLA,ReplayAcquisitionCorp (Replay Acquisition Corp),,Nasdaq
RPM,アールピーエム・インターナショナル (RPM International Inc),素材,NYSE
RRBI,"RedRiverBancsharesInc (Red River Bancshares, Inc)",金融,Nasdaq
RRC,レンジ・リソーシズ (Range Resources Corporation),エネルギー,NYSE
RRD,アールアール・ドネリー・サンズ (R.R. Donnelley & Sons Company),資本財,NYSE
RRGB,レッド・ロビン・グルメ・バーガーズ (Red Robin Gourmet Burgers Inc),一般消費財,Nasdaq
RRR,レッド・ロック・リゾート　クラスA (Red Rock Resorts Inc),一般消費財,Nasdaq
RS,リライアンス・スチール・アンド・アルミナム (Reliance Steel & Aluminum Co),素材,NYSE
RSG,リパブリック・サービシズ (Republic Services Inc),資本財,S&P500
RST,ロゼッタストーン (Rosetta Stone Inc),情報技術,NYSE
RTH,VanEck Vectors Retail ETF (VanEck Vectors Retail ETF),,
RTIX,アールティーアイ・サージカル (RTI Surgical Inc),ヘルスケア,Nasdaq
RTRX,レトロフィン (Retrophin Inc),ヘルスケア,Nasdaq
RTX,レイセオン・テクノロジーズ (Raytheon Technologies),資本財,NYSE
RUBY,"RubiusTherapeuticsInc (Rubius Therapeutics, Inc)",ヘルスケア,Nasdaq
RUN,サンラン (Sunrun Inc),情報技術,Nasdaq
RUSHA,ラッシュ・エンタープライジズ クラスA (Rush Enterprises Inc),一般消費財,Nasdaq
RUSL,Direxion Daily Russia Bull 2X Shares (Direxion Daily Russia Bull 2X Shares),,
RUTH,ルースズ・ホスピタリティ・グループ (Ruths Hospitality Group Inc),一般消費財,Nasdaq
RVLV,"RevolveGroupInc (Revolve Group, Inc)",一般消費財,NYSE
RVMD,"REVOLUTIONMedicinesInc (Revolution Medicines, Inc)",,Nasdaq
RVNC,レバンス・セラピューティクス (Revance Therapeutics Inc),ヘルスケア,Nasdaq
RWLK,リウォーク・ロボティクス (ReWalk Robotics Ltd),ヘルスケア,Nasdaq
RWR,SPDR Dow Jones REIT ETF (SPDR Dow Jones REIT ETF),,
RWX,SPDR Dow Jones International Real Estate ETF (SPDR Dow Jones International Real Estate ETF),,
RXI,iShares Global Consumer Discretionary ETF (iShares Global Consumer Discretionary ETF),,
RXN,レックスノード (Rexnord Corporation),資本財,NYSE
RY,ロイヤル・バンク・オブ・カナダ (Royal Bank of Canada),金融,NYSE
RYCE,アミラ・ネイチャーフーズ (Amira Nature Foods Ltd),生活必需品,NYSE
RYI,ライアーソン・ホールディング (Ryerson Holding Corporation),素材,NYSE
RYTM,"RhythmPharmaceuticalsInc (Rhythm Pharmaceuticals, Inc)",ヘルスケア,Nasdaq
SA,シーブリッジ・ゴールド (Seabridge Gold Inc),素材,NYSE
SABR,セーバー (Sabre Corporation),情報技術,Nasdaq
SAFM,サンダーソン・ファームズ (Sanderson Farms Inc),生活必需品,Nasdaq
SAFT,セーフティー・インシュアランス・グループ (Safety Insurance Group Inc),金融,Nasdaq
SAGE,セージ・セラピューティクス (Sage Therapeutics Inc),ヘルスケア,Nasdaq
SAH,ソニック・オートモーティブ クラスA (Sonic Automotive Inc),一般消費財,NYSE
SAIA,サイア (Saia Inc),資本財,Nasdaq
SAIC,サイエンス・アプリケーションズ・インターナショナル (Science Applications International Corporation),情報技術,NYSE
SAIL,セールポイント・テクノロジーズ・ホールディングス (SailPoint Technologies Holdings Inc),情報技術,NYSE
SALM,セーラム・メディア・グループ クラスA (Salem Media Group Inc),電気通信,Nasdaq
SAM,ボストン・ビア・カンパニー クラスA (The Boston Beer Company Inc),生活必需品,NYSE
SAN,サンタンデール銀行 (Banco Santander S.A),金融,NYSE
SAND,サンドストーム・ゴールド (Sandstorm Gold Ltd),素材,NYSE
SANM,サンミナ (Sanmina Corporation),情報技術,Nasdaq
SANW,Ｓ＆Ｗシード (S&W Seed Company),生活必需品,Nasdaq
SAP,SAP (SAP SE),情報技術,NYSE
SASR,サンディ・スプリング・バンコープ (Sandy Spring Bancorp Inc),金融,Nasdaq
SATS,エコスター クラスA (EchoStar Corporation),情報技術,Nasdaq
SAVA,"キャッサバ・サイエンシズ (Cassava Sciences, Inc)",ヘルスケア,Nasdaq
SAVE,スピリット航空 (Spirit Airlines Inc),資本財,NYSE
SBCF,シーコースト・バンキング・コーポレーション・オブ・フロリダ (Seacoast Banking Corporation of Florida),金融,Nasdaq
SBGI,シンクレア・ブロードキャスト・グループ クラスA (Sinclair Broadcast Group Inc),電気通信,Nasdaq
SBH,サリー・ビューティ・ホールディングス (Sally Beauty Holdings Inc),一般消費財,NYSE
SBLK,スター･バルク･キャリアーズ (Star Bulk Carriers Corp),資本財,Nasdaq
SBNY,シグネチャー・バンク (Signature Bank),金融,Nasdaq
SBPH,スプリング・バンク・ファーマシューティカルズ (Spring Bank Pharmaceuticals Inc),ヘルスケア,Nasdaq
SBS,サンパウロ州基礎衛生公社 (Companhia de Saneamento Bﾃ｡sico do Estado de Sﾃ｣o ),公益事業,NYSE
SBSI,サウスサイド・バンクシェアーズ (Southside Bancshares Inc),金融,Nasdaq
SBT,"SterlingBancorpInc/MI (Sterling Bancorp, Inc. (Southfield, MI))",金融,Nasdaq
SBUX,スターバックス (Starbucks Corp.),一般消費財,Nasdaq S&P500
SC,サンタンダー・コンシューマーＵＳＡ (Santander Consumer USA Holdings Inc),金融,NYSE
SCCO,サザン・コッパー (Southern Copper Corporation),素材,NYSE
SCHL,スコラスティック (Scholastic Corporation),電気通信,Nasdaq
SCHN,シュナイツァー・スチール・インダストリーズ クラスA (Schnitzer Steel Industries Inc),素材,Nasdaq
SCHW,チャールズ・シュワブ (Charles Schwab Corporation),金融,S&P500
SCI,サービス・コーポレーション・インターナショナル (Service Corporation International),生活必需品,NYSE
SCKT,ソケット･モービル (Socket Mobile Inc),情報技術,Nasdaq
SCL,ステパン (Stepan Company),素材,NYSE
SCOR,コムスコア (comScore Inc),資本財,Nasdaq
SCPL,SciplayCorp (SciPlay Corporation),電気通信,Nasdaq
SCS,スチールケース クラスA (Steelcase Inc),資本財,NYSE
SCSC,スキャンソース (ScanSource Inc),一般消費財,Nasdaq
SCTY,"モニトロニクス・インターナショナル (Monitronics International, Inc)",資本財,Nasdaq
SCU,"スカルプター・キャピタル・マネジメント (Sculptor Capital Management, Inc)",金融,NYSE
SCVL,シュー・カーニバル (Shoe Carnival Inc),一般消費財,Nasdaq
SCWX,セキュアワークス　クラスA (SecureWorks Corp),情報技術,Nasdaq
SCX,スターレット (The L.S. Starrett Company),資本財,NYSE
SCYX,サイネクシス (SCYNEXIS Inc),ヘルスケア,Nasdaq
SDC,"SmileDirectClubInc (SmileDirectClub, Inc)",ヘルスケア,Nasdaq
SDGR,"SchrodingerInc/UnitedState (SCHRODINGER, INC.)",ヘルスケア,Nasdaq
SDIV,Global X SuperDividend ETF (Global X SuperDividend ETF),,
SDY,SPDR S&P Dividend ETF (SPDR S&P Dividend ETF),,
SEAS,シーワールド・エンターテイメント (SeaWorld Entertainment Inc),一般消費財,NYSE
SEB,シーボード (Seaboard Corporation),資本財,NYSE
