コード,名称,業種,市場
A,アジレント・テクノロジーズ (Agilent Technologies Inc),ヘルスケア,S&P500
AA,アルコア (Alcoa Corporation),素材,NYSE
AAL,アメリカン航空グループ (American Airlines Group),資本財,Nasdaq S&P500
AAN,アーロンズ (Aarons Inc),資本財,NYSE
AAOI,アプライド・オプトエレクトロニクス (Applied Optoelectronics Inc),情報技術,Nasdaq
AAON,エーエーオーエヌ (AAON Inc),素材,Nasdaq
AAP,アドバンス・オート・パーツ (Advance Auto Parts),一般消費財,S&P500
AAPL,アップル (Apple Inc.),情報技術,NYダウ Nasdaq S&P500
AAU,アルマデン・ミネラルズ (Almaden Minerals Ltd),素材,
AAWW,アトラス・エア・ワールドワイド・ホールディングス (Atlas Air Worldwide Holdings Inc),資本財,Nasdaq
AAXN,アクソン・エンタープライズ (Axon Enterprise Inc),資本財,Nasdaq
ABB,エイ・ビー・ビー (ABB Ltd),資本財,NYSE
ABBV,アッヴィ (AbbVie Inc.),ヘルスケア,S&P500
ABC,アメリソース・バーゲン (AmerisourceBergen Corp),ヘルスケア,S&P500
ABCB,アメリス・バンコープ (Ameris Bancorp),金融,Nasdaq
ABEO,アビオナ・セラピューティクス (Abeona Therapeutics Inc),ヘルスケア,Nasdaq
ABEV,アンベブ (Ambev S.A),生活必需品,NYSE
ABG,アズベリー・オートモーティブ・グループ (Asbury Automotive Group Inc),一般消費財,NYSE
ABM,エービーエム・インダストリーズ (ABM Industries Incorporated),資本財,NYSE
ABMD,アビオメド (ABIOMED Inc),ヘルスケア,Nasdaq S&P500
ABT,アボット・ラボラトリーズ (Abbott Laboratories),ヘルスケア,S&P500
ABTX,"アレジアンス・バンクシェアーズ (Allegiance Bancshares, Inc)",金融,Nasdaq
ACA,アルコサ (Arcosa Inc),資本財,NYSE
ACAD,アカディア・ファーマシューティカルズ (ACADIA Pharmaceuticals Inc),ヘルスケア,Nasdaq
ACAM,AcamarPartnersAcquisition (Acamar Partners Acquisition Corp),資本財,Nasdaq
ACB,オーロラ・カンナビス (Aurora Cannabis Inc),ヘルスケア,
ACBI,"アトランティック・キャピタル・バンクシェアーズ (Atlantic Capital Bancshares, Inc)",金融,Nasdaq
ACCO,エッコー・ブランズ (ACCO Brands Corporation),資本財,NYSE
ACEL,アクセル・エンターテインメント (TPG Pace Holdings Corp),一般消費財,NYSE
ACGL,アーチ・キャピタル・グループ (Arch Capital Group Ltd),金融,Nasdaq
ACHC,アカディア・ヘルスケア (Acadia Healthcare Company Inc),ヘルスケア,Nasdaq
ACHV,アーカイブ・ライフ・サイエンシズ (Achieve Life Sciences Inc),ヘルスケア,Nasdaq
ACIA,アカシア・コミュニケーションズ (Acacia Communications Inc),情報技術,Nasdaq
ACIW,エーシーアイ・ワールドワイド (ACI Worldwide Inc),情報技術,Nasdaq
ACLS,アクセリス・テクノロジーズ (Axcelis Technologies Inc),情報技術,Nasdaq
ACM,エーイーコム・テクノロジー (AECOM),資本財,NYSE
ACMR,"ACMResearchInc (ACM Research, Inc)",情報技術,Nasdaq
ACN,アクセンチュア (Accenture plc),情報技術,S&P500
ACNB,ＡＣＮＢコープ (ACNB Corporation),金融,Nasdaq
ACOR,アコルダ・セラピューティクス (Acorda Therapeutics Inc),ヘルスケア,Nasdaq
ACRS,アクラリス・セラピューティクス (Aclaris Therapeutics Inc),ヘルスケア,Nasdaq
ACRX,アセルRx・ファーマシューティカルズ (AcelRx Pharmaceuticals Inc),ヘルスケア,Nasdaq
ACTG,アカシア・リサーチ (Acacia Research Corporation),資本財,Nasdaq
ACWI,iShares MSCI ACWI ETF (iShares MSCI ACWI ETF),,
ADBE,アドビ・システムズ (Adobe Inc.),情報技術,Nasdaq S&P500
ADES,アドバンスト・エミッションズ・ソリューションズ (Advanced Emissions Solutions Inc),資本財,Nasdaq
ADI,"アナログ・デバイセズ (Analog Devices, Inc.)",情報技術,Nasdaq S&P500
ADM,アーチャー・ダニエルズ・ミッドランド (Archer-Daniels-Midland Co),生活必需品,S&P500
ADMA,ADMAバイオロジックス (ADMA Biologics Inc),ヘルスケア,Nasdaq
ADMP,アダミス・ファーマシューティカルズ (Adamis Pharmaceuticals Corporation),ヘルスケア,Nasdaq
ADMS,アダムズ・ファーマシューティカルズ (Adamas Pharmaceuticals Inc),ヘルスケア,Nasdaq
ADNT,アディエント (Adient plc),一般消費財,NYSE
ADP,オートマティック・データ・プロセッシング (Automatic Data Processing),情報技術,Nasdaq S&P500
ADPT,AdaptiveBiotechnologiesCor (Adaptive Biotechnologies Corporation),ヘルスケア,NYSE
ADRO,アデュロ・バイオテック (Aduro BioTech Inc),ヘルスケア,Nasdaq
ADS,アライアンス・データ・システムズ (Alliance Data Systems),情報技術,S&P500
ADSK,オートデスク (Autodesk Inc.),情報技術,Nasdaq S&P500
ADSW,アドバンスト・ディスポーザル・サービシズ (Advanced Disposal Services Inc),資本財,NYSE
ADTN,アドトラン (ADTRAN Inc),情報技術,Nasdaq
ADUS,アディス・ホームケア (Addus HomeCare Corporation),ヘルスケア,Nasdaq
ADVM,アドヴェルム・バイオテクノロジーズ (Adverum Biotechnologies Inc),ヘルスケア,Nasdaq
ADXS,アドバクシス (Advaxis Inc),ヘルスケア,Nasdaq
AE,アダムス・リソーシズ・アンド・エナジー (Adams Resources & Energy Inc),エネルギー,NYSE
AEE,アメレン (Ameren Corp),公益事業,S&P500
AEG,エイゴン (Aegon N.V),金融,NYSE
AEGN,エイジオン (Aegion Corporation),資本財,Nasdaq
AEIS,アドバンスト・エナジー・インダストリーズ (Advanced Energy Industries Inc),情報技術,Nasdaq
AEL,アメリカン・エクイティ・インベストメント・ライフ・ホールディング (American Equity Investment Life Holding Company),金融,NYSE
AEM,アグニコ・イーグルス・マインズ (Agnico Eagle Mines Limited),素材,NYSE
AEMD,エスロン・メディカル (Aethlon Medical Inc),情報技術,Nasdaq
AEO,アメリカン・イーグル・アウトフィッターズ (American Eagle Outfitters Inc),一般消費財,NYSE
AEP,アメリカン・エレクトリック・パワー (American Electric Power),公益事業,Nasdaq S&P500
AER,エアキャップ・ホールディングス (AerCap Holdings N.V),資本財,NYSE
AERI,アエリー・ファーマシューティカルズ (Aerie Pharmaceuticals Inc),ヘルスケア,Nasdaq
AES,AES (AES Corp),公益事業,S&P500
AEYE,"オーディオアイ (AudioEye, Inc)",情報技術,Nasdaq
AEZS,エテルナ・ゼンタリス (Aeterna Zentaris Inc),ヘルスケア,Nasdaq
AFG,アメリカン・フィナンシャル・グループ (American Financial Group Inc),金融,NYSE
AFI,アームストロング・フローリング (Armstrong Flooring Inc),素材,NYSE
AFK,VanEck Vectors Africa Index ETF (VanEck Vectors Africa Index ETF),,
AFL,アフラック (AFLAC Inc),金融,S&P500
AFYA,AfyaLtd (Afya Limited),一般消費財,Nasdaq
AG,ファースト・マジェスティック・シルバー (First Majestic Silver Corp),素材,NYSE
AGCO,アグコ (AGCO Corporation),資本財,NYSE
AGEN,アジェナス (Agenus Inc),ヘルスケア,Nasdaq
AGFS,アグロフレッシュ・ソリューションズ (AgroFresh Solutions Inc),素材,Nasdaq
AGG,iShares Core U.S. Aggregate Bond ETF (iShares Core U.S. Aggregate Bond ETF),,
AGGY,WisdomTree Yield Enhanced U.S. Aggregate Bond Fund (WisdomTree Yield Enhanced U.S. Aggregate Bond Fund),,
AGI,アラモス･ゴールド (Alamos Gold Inc),素材,NYSE
AGIO,アギオス・ファーマシューティカルズ (Agios Pharmaceuticals Inc),ヘルスケア,Nasdaq
AGLE,アエグリア・バイオセラピューティクス (Aeglea BioTherapeutics Inc),ヘルスケア,Nasdaq
AGM,フェデラル・アグリカルチュアル・モーゲージ　クラスC (Federal Agricultural Mortgage Corporation),金融,NYSE
AGMH,AGMグループ・ホールディングス (AGM Group Holdings Inc),情報技術,Nasdaq
AGO,アシュアード･ギャランティー (Assured Guaranty Ltd),金融,NYSE
AGR,アバングリッド (Avangrid Inc),公益事業,NYSE
AGRX,アジャイル・セラピューティクス (Agile Therapeutics Inc),ヘルスケア,Nasdaq
AGS,"PlayAGSInc (PlayAGS, Inc)",一般消費財,NYSE
AGTC,アプライド・ジェネティック・テクノロジーズ (Applied Genetic Technologies Corporation),ヘルスケア,Nasdaq
AGX,アルガン (Argan Inc),資本財,NYSE
AGYS,"アジリシス (Agilysys, Inc)",情報技術,Nasdaq
AHC,ＡＨベロ (A.H. Belo Corporation),電気通信,NYSE
AHCO,AdaptHealthCorp (AdaptHealth Corp),ヘルスケア,Nasdaq
AIG,アメリカン・インターナショナル・グループ (American International Group),金融,S&P500
AIH,AestheticMedicalInternatio (Aesthetic Medical International Holdings Group Lim),ヘルスケア,Nasdaq
AIMC,アルトラ・インダストリアル・モーション (Altra Industrial Motion Corp),資本財,Nasdaq
AIN,アルバニー・インターナショナル　クラスA (Albany International Corp),一般消費財,NYSE
AIR,エーエーアール (AAR Corp),資本財,NYSE
AIRG,エアゲイン (Airgain Inc),情報技術,Nasdaq
AIRT,エアー・ティー (Air T Inc),資本財,Nasdaq
AIT,アプライド・インダストリアル・テクノロジーズ (Applied Industrial Technologies Inc),資本財,NYSE
AIZ,アシュラント (Assurant),金融,S&P500
AJG,アーサー・J・ギャラガー (Arthur J. Gallagher & Co.),金融,S&P500
AJRD,エアロジェット・ロケットダイン・ホールディングス (Aerojet Rocketdyne Holdings Inc),資本財,NYSE
AKAM,アカマイ・テクノロジーズ (Akamai Technologies Inc),情報技術,Nasdaq S&P500
AKBA,アケビラ・セラピューティクス (Akebia Therapeutics Inc),ヘルスケア,Nasdaq
AKCA,"アクシア・セラピューティクス (Akcea Therapeutics, Inc)",ヘルスケア,Nasdaq
AKRO,"AkeroTherapeuticsInc (Akero Therapeutics, Inc)",ヘルスケア,Nasdaq
AKTS,"AkoustisTechnologiesInc (Akoustis Technologies, Inc)",情報技術,Nasdaq
AL,エア・リース (Air Lease Corporation),資本財,NYSE
ALB,アルベマール (Albemarle Corp),素材,S&P500
ALBO,"アルビレオ・ファーマ (Albireo Pharma, Inc)",ヘルスケア,Nasdaq
ALC,"AlconInc (Alcon, Inc)",ヘルスケア,NYSE
ALCO,アリコ (Alico Inc),生活必需品,Nasdaq
ALDX,アルデイラ･セラピューティクス (Aldeyra Therapeutics Inc),ヘルスケア,Nasdaq
ALE,アレッテ (ALLETE Inc),公益事業,NYSE
ALEC,"AlectorInc (Alector, Inc)",ヘルスケア,Nasdaq
ALG,アラモ・グループ (Alamo Group Inc),資本財,NYSE
ALGN,アライン・テクノロジー (Align Technology),ヘルスケア,Nasdaq S&P500
ALGT,アリージャント・トラベル (Allegiant Travel Company),資本財,Nasdaq
ALIM,アリメラ・サイエンシーズ (Alimera Sciences Inc),ヘルスケア,Nasdaq
ALK,アラスカ航空グループ (Alaska Air Group Inc),資本財,S&P500
ALKS,アルカームス (Alkermes plc),ヘルスケア,Nasdaq
ALL,オールステート (Allstate Corp),金融,S&P500
ALLE,アレジオン (Allegion),資本財,S&P500
ALLK,AllakosInc (Allakos Inc),ヘルスケア,Nasdaq
ALLO,アロジーン・セラピューティクス (Allogene Therapeutics Inc),ヘルスケア,Nasdaq
ALLY,アライ・フィナンシャル (Ally Financial Inc),金融,NYSE
ALNY,アルナイラム・ファーマシューティカルズ (Alnylam Pharmaceuticals Inc),ヘルスケア,Nasdaq
ALOT,"アストロノバ (AstroNova, Inc)",情報技術,Nasdaq
ALPN,アルパイン・イミューン・サイエンシズ (Alpine Immune Sciences Inc),ヘルスケア,Nasdaq
ALRM,アラーム・ドットコム・ホールディングス (Alarm.com Holdings Inc),情報技術,Nasdaq
ALRN,エルロン・セラピューティクス (Aileron Therapeutics Inc),ヘルスケア,Nasdaq
ALRS,アレラス・ファイナンシャル (Alerus Financial Corporation),金融,Nasdaq
ALSK,アラスカ・コミュニケーションズ・システムズ・グループ (Alaska Communications Systems Group Inc),電気通信,Nasdaq
ALSN,アリソン・トランスミッション・ホールディングス (Allison Transmission Holdings Inc),一般消費財,NYSE
ALT,アルティミューン (Altimmune Inc),ヘルスケア,Nasdaq
ALTR,アルテアエンジニアリング　クラスA (Altair Engineering Inc),情報技術,Nasdaq
ALTY,Global X SuperDividend Alternatives ETF (Global X SuperDividend Alternatives ETF),,
ALV,オートリブ (Autoliv Inc),一般消費財,NYSE
ALXN,アレクション・ファーマシューティカルズ (Alexion Pharmaceuticals),ヘルスケア,Nasdaq S&P500
AM,アンテロ・ミッドストリーム (Antero Midstream Corporation),エネルギー,NYSE
AMAG,エーエムエージー・ファーマシューティカルズ (AMAG Pharmaceuticals Inc),ヘルスケア,Nasdaq
AMAL,アマルガメイテッド・バンク・オブ・ニューヨーク　クラスA (Amalgamated Bank),金融,Nasdaq
AMAT,アプライド・マテリアルズ (Applied Materials Inc.),情報技術,Nasdaq S&P500
AMBA,アンバレラ (Ambarella Inc),情報技術,Nasdaq
AMBC,ＡＭＢＣフィナンシャル・グループ (Ambac Financial Group Inc),金融,Nasdaq
AMC,AMCエンターテインメント クラスA (AMC Entertainment Holdings Inc),一般消費財,NYSE
AMCR,AmcorPLC (Amcor plc),素材,NYSE
AMCX,AMCネットワークス クラスA (AMC Networks Inc),一般消費財,Nasdaq
AMD,アドバンスド・マイクロ・デバイシズ (Advanced Micro Devices Inc),情報技術,Nasdaq S&P500
AME,アメテック (AMETEK Inc.),資本財,S&P500
AMED,アメディシス (Amedisys Inc),ヘルスケア,Nasdaq
AMEH,"ApolloMedicalHoldingsInc (Apollo Medical Holdings, Inc)",ヘルスケア,Nasdaq
AMG,アフィリエーテッド・マネジャーズ・グループ (Affiliated Managers Group Inc),金融,S&P500
AMGN,アムジェン (Amgen Inc.),ヘルスケア,NYダウ Nasdaq S&P500
AMK,"AssetmarkFinancialHoldings (AssetMark Financial Holdings, Inc)",金融,NYSE
AMKR,アムコー・テクノロジー (Amkor Technology Inc),情報技術,Nasdaq
AMN,エーエムエヌ・ヘルスケア・サービシズ (AMN Healthcare Services Inc),ヘルスケア,NYSE
AMNB,アメリカン・ナショナル・バンクシェアーズ (American National Bankshares Inc),金融,Nasdaq
AMOT,アライド・モーション・テクノロジーズ (Allied Motion Technologies Inc),情報技術,Nasdaq
AMP,アメリプライズ・ファイナンシャル (Ameriprise Financial),金融,S&P500
AMPE,アンピオ・ファーマシューティカルズ (Ampio Pharmaceuticals Inc),ヘルスケア,NYSE
AMPH,アンファスター･ファーマシューティカルズ (Amphastar Pharmaceuticals Inc),ヘルスケア,Nasdaq
AMRC,アメレスコ クラスA (Ameresco Inc),資本財,NYSE
AMRN,アマリン (Amarin Corporation plc),ヘルスケア,Nasdaq
AMRS,アミリス (Amyris Inc),素材,Nasdaq
AMRX,アムニール・ファーマシューティカルズ (Amneal Pharmaceuticals Inc),ヘルスケア,NYSE
AMSC,アメリカン・スーパーコンダクター (American Superconductor Corporation),情報技術,Nasdaq
AMSF,アメリセーフ (Amerisafe Inc),金融,Nasdaq
AMSWA,アメリカン・ソフトウェア クラスA (American Software Inc),情報技術,Nasdaq
AMTB,AmerantBancorpInc (Amerant Bancorp Inc),金融,Nasdaq
AMTD,ティーディー・アメリトレード・ホールディング (TD Ameritrade Holding Corporation),金融,Nasdaq
AMTX,アメティス (Aemetis Inc),素材,Nasdaq
AMWD,アメリカン・ウッドマーク (American Woodmark Corporation),一般消費財,Nasdaq
AMX,"アメリカ・モビル (America Movil, S.A.B. de C.V)",電気通信,NYSE
AMZN,アマゾン・ドット・コム (Amazon.com Inc.),一般消費財,Nasdaq S&P500
AN,オートネーション (AutoNation Inc),一般消費財,NYSE
ANAB,アナプティスバイオ (AnaptysBio Inc),ヘルスケア,Nasdaq
ANAT,アメリカン・ナショナル・インシュアランス (American National Insurance Company),金融,Nasdaq
ANDA,AndinaAcquisitionCorpIII (Andina Acquisition Corp. III),資本財,Nasdaq
ANDE,アンダーソンズ (The Andersons Inc),生活必需品,Nasdaq
ANET,アリスタ・ネットワークス (Arista Networks),情報技術,S&P500
ANF,アバクロンビーアンドフィッチ クラスA (Abercrombie & Fitch Co),一般消費財,NYSE
ANGI,ANGIHomeservicesInc (ANGI Homeservices Inc),電気通信,Nasdaq
ANGO,アンジオダイナミクス (AngioDynamics Inc),ヘルスケア,Nasdaq
ANIK,アニカ・セラピューティクス (Anika Therapeutics Inc),ヘルスケア,Nasdaq
ANIP,ＡＮＩ・ファーマシューティカルズ (ANI Pharmaceuticals Inc),ヘルスケア,Nasdaq
ANIX,アニクサ・バイオサイエンシズ (Anixa Biosciences Inc),ヘルスケア,Nasdaq
ANSS,アンシス (ANSYS),情報技術,Nasdaq S&P500
ANTM,アンセム (Anthem),ヘルスケア,S&P500
AON,エーオン (Aon plc),金融,S&P500
AOS,AOスミス (A.O. Smith Corp),資本財,S&P500
AOSL,アルファ&オメガ・セミコンダクター (Alpha and Omega Semiconductor Limited),情報技術,Nasdaq
AP,アンプコピッツバーグ (Ampco-Pittsburgh Corporation),資本財,NYSE
APA,アパッチ (Apache Corporation),エネルギー,S&P500
APAM,アルチザン・パートナーズ・アセットマネジメント クラスA (Artisan Partners Asset Management Inc),金融,NYSE
APD,エアープロダクツ・アンド・ケミカルズ (Air Products & Chemicals Inc),素材,S&P500
APDN,アプライド・DNA・サイエンシズ (Applied DNA Sciences Inc),資本財,Nasdaq
APEI,アメリカン・パブリック・エデュケーション (American Public Education Inc),一般消費財,Nasdaq
APEN,アポロ・エンドサージェリー (Apollo Endosurgery Inc),ヘルスケア,Nasdaq
APH,アンフェノール (Amphenol Corp),情報技術,S&P500
APHA,アフリア (Aphria Inc),ヘルスケア,NYSE
APLS,"アペリス・ファーマシューティカルズ (Apellis Pharmaceuticals, Inc)",ヘルスケア,Nasdaq
APLT,"AppliedTherapeuticsInc (Applied Therapeutics, Inc)",ヘルスケア,Nasdaq
APOG,アポジー・エンタープライジズ (Apogee Enterprises Inc),素材,Nasdaq
APPF,アップフォリオ　クラスA (AppFolio Inc),情報技術,Nasdaq
APPN,アピアン (Appian Corporation),情報技術,Nasdaq
APPS,デジタル・タービン (Digital Turbine Inc),情報技術,Nasdaq
APRE,"ApreaTherapeuticsInc (Aprea Therapeutics, Inc)",ヘルスケア,Nasdaq
APRN,ブルー・エプロン・ホールディングス　クラスA (Blue Apron Holdings Inc),一般消費財,NYSE
APT,アルファ・プロ・テック (Alpha Pro Tech Ltd),素材,NYSE
APTO,アポトース・バイオサイエンシズ (Aptose Biosciences Inc),ヘルスケア,Nasdaq
APTV,デルファイ・オートモーティブ (Aptiv PLC),一般消費財,S&P500
APVO,アプテボ・セラピューティクス (Aptevo Therapeutics Inc),ヘルスケア,Nasdaq
APYX,エイピックス (Apyx Medical Corporation),ヘルスケア,NYSE
AQB,アクアバウンティ・テクノロジーズ (AquaBounty Technologies Inc),ヘルスケア,Nasdaq
AQN,アルゴンキンパワー・アンド・ユーティリティーズ (Algonquin Power & Utilities Corp),公益事業,NYSE
AQST,"AquestiveTherapeuticsInc (Aquestive Therapeutics, Inc)",ヘルスケア,Nasdaq
AQUA,エヴォクア・ウォーター・テクノロジーズ (Evoqua Water Technologies Corp),資本財,NYSE
AR,アンテロ・リソーシズ (Antero Resources Corporation),エネルギー,NYSE
ARA,アメリカン・リーナル・アソシエイツ・ホールディングス (American Renal Associates Holdings Inc),ヘルスケア,NYSE
ARAV,アラバイブ (Aravive Inc),ヘルスケア,Nasdaq
ARAY,アキュレイ (Accuray Incorporated),ヘルスケア,Nasdaq
ARCB,アークベスト (ArcBest Corporation),資本財,Nasdaq
ARCC,エイリス・キャピタル (Ares Capital Corporation),金融,Nasdaq
ARCH,"アーチ・コール (Arch Coal, Inc)",エネルギー,NYSE
ARCO,アルコス・ドラドス (Arcos Dorados Holdings Inc),一般消費財,NYSE
ARCT,アークトゥルス・セラピューティクス (Arcturus Therapeutics Ltd),ヘルスケア,Nasdaq
ARD,アルダフ・グループ (Ardagh Group S.A),素材,NYSE
ARDS,アリディス・ファーマシューティカルズ (Aridis Pharmaceuticals Inc),ヘルスケア,Nasdaq
ARDX,アーデリクス (Ardelyx Inc),ヘルスケア,Nasdaq
ARES,アレス・マネジメント (Ares Management Corporation),金融,NYSE
ARGO,"アルゴ・グループ・インターナショナルHldg (Argo Group International Holdings, Ltd)",金融,NYSE
ARGX,アルジェンX (argenx SE),ヘルスケア,Nasdaq
ARKR,アーク・レストランツ (Ark Restaurants Corp),一般消費財,Nasdaq
ARL,"アメリカン・リアルティ・インベスターズ (American Realty Investors, Inc)",不動産,NYSE
ARLO,アーロ・テクノロジーズ (Arlo Technologies Inc),情報技術,NYSE
ARMK,アラマーク・ホールディングス (Aramark),一般消費財,NYSE
ARMP,"アーマタ・ファーマシューティカルズ (Armata Pharmaceuticals, Inc)",ヘルスケア,NYSE
ARNA,アリーナ・ファーマシューティカルズ (Arena Pharmaceuticals Inc),ヘルスケア,Nasdaq
ARNC,アルコニック (Arconic Inc.),資本財,S&P500
AROC,アーチロック (Archrock Inc),エネルギー,NYSE
AROW,アロー・フィナンシャル (Arrow Financial Corporation),金融,Nasdaq
ARQT,"ArcutisBiotherapeuticsInc (ARCUTIS BIOTHERAPEUTICS, INC.)",,Nasdaq
ARTNA,アルテシアン・リソーシズ クラスA (Artesian Resources Corporation),公益事業,Nasdaq
ARVN,"ArvinasInc (Arvinas, Inc)",ヘルスケア,Nasdaq
ARW,アロー・エレクトロニクス (Arrow Electronics Inc),情報技術,NYSE
ARWR,アローヘッド･ファーマシューティカルズ (Arrowhead Pharmaceuticals Inc),ヘルスケア,Nasdaq
ASB,アソシエーテッド・バンコープ (Associated Banc-Corp),金融,NYSE
ASFI,アスタ・ファンディング (Asta Funding Inc),金融,Nasdaq
ASGN,オン・アサインメント (ASGN Incorporated),資本財,NYSE
ASH,アシュランド (Ashland Global Holdings Inc),素材,NYSE
ASIX,アドバンシックス (AdvanSix Inc),素材,NYSE
ASM,アヴィーノ・シルバー＆ゴールド・マインズ (Avino Silver & Gold Mines Ltd),素材,
ASMB,アセンブリー・バイオサイエンシズ (Assembly Biosciences Inc),ヘルスケア,Nasdaq
ASML,ASMLホールディング (ASML Holding N.V),情報技術,Nasdaq
ASPS,アルテソース・ポートフォリオ・ソリューションズ (Altisource Portfolio Solutions S.A),金融,Nasdaq
ASPU,アスペン・グループ (Aspen Group Inc),一般消費財,Nasdaq
ASRT,アサーシオ・セラピューティクス (Assertio Therapeutics Inc),ヘルスケア,Nasdaq
ASTE,アステック・インダストリーズ (Astec Industries Inc),資本財,Nasdaq
ASX,"日月光投資控股[ASEテクノロジー・ホー (ASE Technology Holding Co., Ltd)",情報技術,NYSE
ASYS,アムテック・システムズ (Amtech Systems Inc),情報技術,Nasdaq
ATCO,AtlasCorp (Atlas Corp),,NYSE
ATEC,"アルファテック・ホールディングス (Alphatec Holdings, Inc)",ヘルスケア,Nasdaq
ATEN,A10ネットワークス (A10 Networks Inc),情報技術,NYSE
ATEX,アンテリックス (Anterix Inc),電気通信,Nasdaq
ATGE,ディブライ・エデュケーション・グループ (Adtalem Global Education Inc),一般消費財,NYSE
ATH,アテネ・ホールディング (Athene Holding Ltd),金融,NYSE
ATHM,オート・ホーム (Autohome Inc),情報技術,NYSE
ATHX,アサーシス (Athersys Inc),ヘルスケア,Nasdaq
ATI,アリゲニー・テクノロジーズ (Allegheny Technologies Incorporated),素材,NYSE
ATKR,アトコア・インターナショナル・グループ　クラスI (Atkore International Group Inc),資本財,NYSE
ATLO,エイムズ・ナショナル (Ames National Corporation),金融,Nasdaq
ATNI,アトランティック・テレネットワーク (ATN International Inc),電気通信,Nasdaq
ATNM,アクチニウム・ファーマシューティカルズ (Actinium Pharmaceuticals Inc),ヘルスケア,NYSE
ATNX,"アテネックス (Athenex, Inc)",ヘルスケア,Nasdaq
ATO,アトモス・エナジー (Atmos Energy Corporation),公益事業,NYSE
ATOS,アトサ・ジェネティック (Atossa Genetics Inc),ヘルスケア,Nasdaq
ATR,アプターグループ (AptarGroup Inc),素材,NYSE
ATRA,アタラ・バイオセラピューティクス (Atara Biotherapeutics Inc),ヘルスケア,Nasdaq
ATRC,アトリキュア (AtriCure Inc),ヘルスケア,Nasdaq
ATRI,アトリオン・コーポレーション (Atrion Corporation),ヘルスケア,Nasdaq
ATRO,アストロニクス (Astronics Corporation),資本財,Nasdaq
ATRS,アンタレス・ファーマ (Antares Pharma Inc),ヘルスケア,Nasdaq
ATSG,エア・トランスポート・サービシズ・グループ (Air Transport Services Group Inc),資本財,Nasdaq
ATUS,アルティスUSA (Altice USA Inc),電気通信,NYSE
ATV,"エイコーン・インターナショナル (Acorn International, Inc)",一般消費財,NYSE
ATVI,アクティビジョン・ブリザード (Activision Blizzard),電気通信,Nasdaq S&P500
AU,アングロゴールド・アシャンティ (AngloGold Ashanti Limited),素材,NYSE
AUB,アトランティック・ユニオン・バンクシェアーズ (Atlantic Union Bankshares Corporation),金融,Nasdaq
AUDC,オーディオコーズ (AudioCodes Ltd),情報技術,Nasdaq
AUMN,ゴールデン・ミネラルズ (Golden Minerals Company),素材,NYSE
AUPH,オーリニア・ファーマシューティカルズ (Aurinia Pharmaceuticals Inc),ヘルスケア,Nasdaq
AUTL,オートルス・セラピューティクス (Autolus Therapeutics plc),ヘルスケア,Nasdaq
AUTO,オートウェブ (AutoWeb Inc),情報技術,Nasdaq
